{
  "schema": "https://pgs.local/schemas/module.manifest.schema.json",
  "name": "update",
  "version": "1.0.0",
  "abi": 3,
  "summary": "Local release manifest verifier.",
  "risk": "medium",
  "capabilities": ["update.verify"],
  "methods": [
    {"name": "update.status", "risk": "low", "sync": true, "required_capabilities": ["update.verify"], "params_schema": {"type": "object"}, "result_schema": {"type": "object"}},
    {"name": "update.verify", "risk": "medium", "sync": true, "required_capabilities": ["update.verify"], "params_schema": {"type": "object"}, "result_schema": {"type": "object"}}
  ]
}
