{
  "schema": "https://pgs.local/schemas/module.manifest.schema.json",
  "name": "remote_agent",
  "version": "1.0.0",
  "abi": 3,
  "summary": "Local cluster-agent metadata surface.",
  "risk": "medium",
  "capabilities": ["remote_agent.status", "guard.list", "health.stats"],
  "methods": [
    {"name": "remote_agent.status", "risk": "low", "sync": true, "required_capabilities": ["remote_agent.status", "health.stats"], "params_schema": {"type": "object"}, "result_schema": {"type": "object"}},
    {"name": "remote_agent.guards", "risk": "low", "sync": true, "required_capabilities": ["remote_agent.status", "guard.list"], "params_schema": {"type": "object"}, "result_schema": {"type": "object"}}
  ]
}
